[
  {
    "attributes": [
      "long_term_owned"
    ],
    "deal_paths": [
      {
        "confidence": "moderate",
        "path": "sub_to",
        "rationale": "Foreclosure on long-term-owned parcel; investigate loan terms for subject-to."
      },
      {
        "confidence": "moderate",
        "path": "wholesale",
        "rationale": "Single-signal distress; lower-conviction wholesale candidate."
      }
    ],
    "display_patterns": [
      "foreclosure"
    ],
    "doc_type_normalization": {
      "canonical_doc_types": [
        "sheriff_sale"
      ],
      "doc_type_review_required": false,
      "normalized_doc_types": [
        "SHERIFF_SALE"
      ]
    },
    "enrichment_status": "ENRICHED",
    "evidence_ids": [
      "ev_bcd764ddf64df37d"
    ],
    "lead_id": "lead_parcel_SYN-005",
    "lead_status": "APPROVED_FOR_DASHBOARD",
    "lead_status_history": [
      {
        "reason": "no review flags triggered",
        "status": "APPROVED_FOR_DASHBOARD",
        "transitioned_at": "2026-07-16T20:07:18Z"
      }
    ],
    "match_confidence": null,
    "owner_name": "TEST_OWNER_005",
    "owner_type": "INDIVIDUAL",
    "parcel_display": {
      "assessed_value": 265000,
      "last_sale_date": "2001-11-30",
      "last_sale_price": 165000,
      "owner_mailing_address": null,
      "owner_mailing_city": "Synthtown E",
      "owner_mailing_state": "ZZ",
      "owner_mailing_zip": "00005",
      "situs_address": "500 Synthetic Lane",
      "situs_city": "Synthtown E",
      "situs_state": "ZZ",
      "year_built": 1990
    },
    "pattern_set": [
      "foreclosure"
    ],
    "patterns": [
      "foreclosure"
    ],
    "primary_event_date": "2026-05-12",
    "primary_parcel_id": "SYN-005",
    "recent_flag": true,
    "review_flags": [],
    "score": 68,
    "score_reasons": [
      {
        "delta": 60,
        "factor": "base_SHERIFF_SALE"
      },
      {
        "delta": 5,
        "factor": "recent_filing_within_30_days"
      },
      {
        "delta": 3,
        "factor": "attribute_bonus"
      }
    ],
    "scored_lead_id": "scored_1460ee88c1b415a2",
    "source_ids": [
      "sheriff_synthetic"
    ],
    "stack_depth": 1,
    "tier": "Strong",
    "title_complexity_contributors": [],
    "title_complexity_score": 0,
    "title_complexity_tier": "None"
  },
  {
    "attributes": [
      "free_and_clear",
      "high_equity",
      "long_term_owned",
      "senior_owner"
    ],
    "deal_paths": [
      {
        "confidence": "high",
        "path": "partial_interest",
        "rationale": "Estate pattern paired with intra-family transfer or long-held parcel; multiple heirs likely."
      },
      {
        "confidence": "moderate",
        "path": "wholesale",
        "rationale": "Single-signal distress; lower-conviction wholesale candidate."
      }
    ],
    "display_patterns": [
      "estate"
    ],
    "doc_type_normalization": {
      "canonical_doc_types": [
        "executors_deed"
      ],
      "doc_type_review_required": false,
      "normalized_doc_types": [
        "EXECUTORS_DEED"
      ]
    },
    "enrichment_status": "ENRICHED",
    "evidence_ids": [
      "ev_befde6e733404f1f"
    ],
    "lead_id": "lead_parcel_SYN-012",
    "lead_status": "APPROVED_FOR_DASHBOARD",
    "lead_status_history": [
      {
        "reason": "no review flags triggered",
        "status": "APPROVED_FOR_DASHBOARD",
        "transitioned_at": "2026-07-16T20:07:18Z"
      }
    ],
    "match_confidence": null,
    "owner_name": "TEST_OWNER_012_ESTATE_OF",
    "owner_type": "INDIVIDUAL",
    "parcel_display": {
      "assessed_value": 225000,
      "last_sale_date": "1990-11-28",
      "last_sale_price": 78000,
      "owner_mailing_address": null,
      "owner_mailing_city": "Synthtown L",
      "owner_mailing_state": "ZZ",
      "owner_mailing_zip": "00012",
      "situs_address": "1200 Synthetic Lane",
      "situs_city": "Synthtown L",
      "situs_state": "ZZ",
      "year_built": 1968
    },
    "pattern_set": [
      "estate"
    ],
    "patterns": [
      "estate"
    ],
    "primary_event_date": "2026-02-28",
    "primary_parcel_id": "SYN-012",
    "recent_flag": false,
    "review_flags": [],
    "score": 47,
    "score_reasons": [
      {
        "delta": 35,
        "factor": "base_EXECUTORS_DEED"
      },
      {
        "delta": 12,
        "factor": "attribute_bonus"
      }
    ],
    "scored_lead_id": "scored_1539074d1b0cb45f",
    "source_ids": [
      "clerk_synthetic"
    ],
    "stack_depth": 1,
    "tier": "Low",
    "title_complexity_contributors": [],
    "title_complexity_score": 0,
    "title_complexity_tier": "None"
  },
  {
    "attributes": [],
    "deal_paths": [
      {
        "confidence": "moderate",
        "path": "wholesale",
        "rationale": "Single-signal distress; lower-conviction wholesale candidate."
      }
    ],
    "display_patterns": [
      "bankruptcy"
    ],
    "doc_type_normalization": {
      "canonical_doc_types": [
        "bankruptcy_petition"
      ],
      "doc_type_review_required": false,
      "normalized_doc_types": [
        "BANKRUPTCY_PETITION"
      ]
    },
    "enrichment_status": "UNENRICHED",
    "evidence_ids": [
      "ev_53a49fb2725bf9eb"
    ],
    "lead_id": "lead_unresolved_BK-13-SYN-001",
    "lead_status": "REVIEW_REQUIRED",
    "lead_status_history": [
      {
        "reason": "parcel_resolution_review_required; matched_lead_review_reason:owner_not_on_document",
        "status": "REVIEW_REQUIRED",
        "transitioned_at": "2026-07-16T20:07:18Z"
      }
    ],
    "match_confidence": null,
    "owner_name": "bankruptcy_petition against unidentified party",
    "owner_type": "UNKNOWN",
    "parcel_display": null,
    "pattern_set": [
      "bankruptcy"
    ],
    "patterns": [
      "bankruptcy"
    ],
    "primary_event_date": "2026-04-25",
    "primary_parcel_id": null,
    "recent_flag": true,
    "review_flags": [
      "parcel_resolution_review_required",
      "matched_lead_review_reason:owner_not_on_document"
    ],
    "score": 55,
    "score_reasons": [
      {
        "delta": 50,
        "factor": "base_BANKRUPTCY_PETITION"
      },
      {
        "delta": 5,
        "factor": "recent_filing_within_30_days"
      }
    ],
    "scored_lead_id": "scored_0490e05d9652b10e",
    "source_ids": [
      "clerk_synthetic"
    ],
    "stack_depth": 1,
    "tier": "Workable",
    "title_complexity_contributors": [],
    "title_complexity_score": 0,
    "title_complexity_tier": "None"
  },
  {
    "attributes": [],
    "deal_paths": [
      {
        "confidence": "moderate",
        "path": "wholesale",
        "rationale": "Single-signal distress; lower-conviction wholesale candidate."
      }
    ],
    "display_patterns": [
      "divorce"
    ],
    "doc_type_normalization": {
      "canonical_doc_types": [
        "marital_property_division"
      ],
      "doc_type_review_required": false,
      "normalized_doc_types": [
        "MARITAL_PROPERTY_DIVISION"
      ]
    },
    "enrichment_status": "UNENRICHED",
    "evidence_ids": [
      "ev_7ac8d2116ced032b"
    ],
    "lead_id": "lead_unresolved_FM-SYN-007",
    "lead_status": "REVIEW_REQUIRED",
    "lead_status_history": [
      {
        "reason": "parcel_resolution_review_required; matched_lead_review_reason:owner_not_on_document",
        "status": "REVIEW_REQUIRED",
        "transitioned_at": "2026-07-16T20:07:18Z"
      }
    ],
    "match_confidence": null,
    "owner_name": "marital_property_division against unidentified party",
    "owner_type": "UNKNOWN",
    "parcel_display": null,
    "pattern_set": [
      "divorce"
    ],
    "patterns": [
      "divorce"
    ],
    "primary_event_date": "2026-03-28",
    "primary_parcel_id": null,
    "recent_flag": false,
    "review_flags": [
      "parcel_resolution_review_required",
      "matched_lead_review_reason:owner_not_on_document"
    ],
    "score": 45,
    "score_reasons": [
      {
        "delta": 45,
        "factor": "base_MARITAL_PROPERTY_DIVISION"
      }
    ],
    "scored_lead_id": "scored_9c27290e4398bb4a",
    "source_ids": [
      "court_synthetic"
    ],
    "stack_depth": 1,
    "tier": "Low",
    "title_complexity_contributors": [],
    "title_complexity_score": 0,
    "title_complexity_tier": "None"
  },
  {
    "attributes": [],
    "deal_paths": [
      {
        "confidence": "moderate",
        "path": "wholesale",
        "rationale": "Single-signal distress; lower-conviction wholesale candidate."
      }
    ],
    "display_patterns": [
      "estate"
    ],
    "doc_type_normalization": {
      "canonical_doc_types": [
        "letters_testamentary"
      ],
      "doc_type_review_required": false,
      "normalized_doc_types": [
        "LETTERS_TESTAMENTARY"
      ]
    },
    "enrichment_status": "UNENRICHED",
    "evidence_ids": [
      "ev_8927407c98d3f03b"
    ],
    "lead_id": "lead_unresolved_P-SYN-009",
    "lead_status": "REVIEW_REQUIRED",
    "lead_status_history": [
      {
        "reason": "parcel_resolution_review_required; matched_lead_review_reason:document_body_debtor_not_extractable",
        "status": "REVIEW_REQUIRED",
        "transitioned_at": "2026-07-16T20:07:18Z"
      }
    ],
    "match_confidence": null,
    "owner_name": "letters_testamentary against unidentified party",
    "owner_type": "UNKNOWN",
    "parcel_display": null,
    "pattern_set": [
      "estate"
    ],
    "patterns": [
      "estate"
    ],
    "primary_event_date": "2026-01-15",
    "primary_parcel_id": null,
    "recent_flag": false,
    "review_flags": [
      "parcel_resolution_review_required",
      "matched_lead_review_reason:document_body_debtor_not_extractable"
    ],
    "score": 55,
    "score_reasons": [
      {
        "delta": 55,
        "factor": "base_LETTERS_TESTAMENTARY"
      }
    ],
    "scored_lead_id": "scored_ab4299889148a69f",
    "source_ids": [
      "court_synthetic"
    ],
    "stack_depth": 1,
    "tier": "Workable",